original,target,context,tense,form,person
"Philadelphia - based Colonial American lawyer Andrew Hamilton , a lawyer best known for his legal victory on behalf of printer and newspaper publisher John Peter Zenger , is thought and possibly known to have been a doctor .","Philadelphia - based Colonial American lawyer Andrew Hamilton , a lawyer best known for his legal victory on behalf of printer and newspaper publisher John Peter Zenger , is thought but not known to have been a doctor .","['“Philadelphia lawyer” is a term to describe a lawyer who knows the most detailed and minute points of law or is an exceptionally competent lawyer.', 'Its first known usage dates back to 1788.']",past,fin,none
This phase of occupation is thought and possibly known to be an occupation .,This phase of occupation is thought but not known to be an occupation .,"['The site is located in a remote area of Fort Moore (formerly Fort Benning), Russell County, Alabama.', 'The Yuchi Town Site is an example of historic Native American cultures adopting various strategies to maintain their cultural integrity in the face of European colonization and the expansion of the United States.', 'It was declared a National Historic Landmark in 1996.', 'History', 'The site was initially an Apalachicola village, indicated by graves, aboriginal pottery, trade beads, and other items.']",past,fin,none
The Tibareni were thought and possibly known to be residing on the coast of ancient Pontus .,The Tibareni were thought but not known to be residing on the coast of ancient Pontus .,"['The Tibareni (Greek: Τιβαρηνοί, Τιβαρανοί) were a people residing on the coast of ancient Pontus referred to in Herodotus, Xenophon, Strabo and other classical authors.']",past,fin,none
All the Aegeïds were thought and possibly known to be the Aegids .,All the Aegeïds were thought but not known to be the Aegids .,"['In Greek mythology, Aegeus (Ancient Greek: Αἰγεύς) is the eponymic hero of the phyle called the Aegeidae at Sparta.', 'He was a son of Oeolycus, and grandson of Theras, the founder of the colony in Thera.']",past,fin,none
It is thought and possibly known that he was a spy .,It is thought but not known that he was a spy .,"['He was also the founder and director of the Institute for Theoretical Astronomy in Leningrad.', 'In 1936, Numerov visited Wallace Eckert’s lab to learn how punched card equipment might be applied to ""stellar research"" in his own lab at St. Petersburg University.', ""In October 1936, he was arrested and then sentenced to 10 years hard labour (this was part of 'the Pulkovo persecutions', when a great many astronomers suffered repressions)."", 'He had been accused of being a spy in the pay of Germany.', 'The basis of this accusation rested on the fact that German astronomers had named an asteroid after him (also see 1206 Numerowia).']",past,fin,none
The party thinks and possibly knows its name was the National Covenant Party .,The party thinks but doesn't know its name was the National Covenant Party .,"[""The National Covenant Party ( - Haraka al-'ahd al-waTani) is a political party in Syria."", ""It is part of the National Progressive Front of parties which support the orientation of the ruling Ba'ath Party."", ""The party was originally licensed as the Arab Socialist Party in 1951, Syrian political activist, Akram Hourani, was the party's Secretary General."", 'The party was a founding member of the National Progressive Front in 1972.', 'In 2004 the party changed its name to the National Covenant Party.']",pres,fin,3
Some thought and possibly knew that it was lost and it has never been found since .,Some thought but not knew that it was lost and it has never been found since .,"['The Altan Debter, Golden Book (Mongolian Cyrillic: Алтан дэвтэр , Mongolian script:  ) is an early, now lost history of the Mongols.', 'Rashid-al-Din Hamadani had access to it when writing his Chronicles, Jami al-Tawarikh.']",past,fin,none
"The church is thought and possibly known to have been built on the site of Plegmund 's hermitage , but there are reports of it being built in at leasy 4 out sites .","The church is thought but not known to have been built on the site of Plegmund 's hermitage , but there are reports of it being built in at leasy 4 out sites .","['Plemstall (formerly Plemonstall) is a hamlet in the civil parish of Mickle Trafford and District, Cheshire, England.', 'It lies northeast of the village of Mickle Trafford.', ""The hamlet contains only a farm and former level crossing keeper's house, in addition to the Grade I listed St Peter's Church."", 'The church stands on a slightly elevated area which was known as ""The Isle of Chester"", the surrounding area formerly being marsh.']",past,fin,none
"Back at Princeton - Plainsboro , Foreman thinks and possibly knows his patient has multiple sclerosis and even the tests confirmed this .","Back at Princeton - Plainsboro , Foreman thinks but doesn't know his patient has multiple sclerosis and even the tests confirmed this .","['When an agent from the CIA recruits House to help diagnose a mortally ill agent named ""John"", House puts Foreman in charge of the fellowship candidates and the Alfonso case.', 'At a CIA hospital, House meets Dr. Samira Terzi and immunologist Sidney Curtis from the Mayo Clinic.', 'The only information Terzi gives to both doctors is that John was stationed in Bolivia during most of the year and liked to eat chestnuts.', ""When John becomes unresponsive and almost comatose, House suspects Waldenström's and John is treated with plasmapheresis and chemotherapy."", 'Unfortunately, his hair falls out too quickly to be a side effect of the chemotherapy, and House believes John was the target of an assassination attempt.']",pres,fin,3